{
  "schema_version": 1,
  "project": {
    "id": "N-O2608-PSD-087",
    "context_manifest": "N-O2608-PSD-087.json",
    "scope": "all-indexed-functions"
  },
  "corpus": {
    "index_csv": "../../examples/N-O2608-PSD-087/HOYU/N-O2608-PSD-087.csv",
    "product_root": "../../examples/N-O2608-PSD-087/Soft",
    "golden_root": "../../examples/N-O2608-PSD-087/winAMS"
  },
  "evidence": {
    "baseline_document": "../../docs/単体テスト項目基準書_Ver.1.6.xlsx",
    "baseline_sheet": "PSD再構築",
    "baseline_revision": "Ver.1.6"
  }
}
